{
  "$schema": "https://json-schema.org/draft/2020-12/schema",
  "$id": "https://github.com/vtex-prototypes/mocked-product-catalog/schema/product.schema.json",
  "title": "Product",
  "description": "One product in the mock catalog. Lives in products/<id>.json; images live in images/<id>/. Every human-readable string is localized (en + pt-BR) and every price is given in BRL and USD.",
  "type": "object",
  "additionalProperties": false,
  "required": ["id", "name", "categoryId", "description", "price", "availability", "tags", "defaultVariantId", "options", "variants"],
  "$defs": {
    "deprecated": {
      "type": "object",
      "additionalProperties": false,
      "required": ["reason"],
      "description": "Marks something that will be removed in the next major release. Prototypes that load it get a warning. Remove it only in a major release after this one.",
      "properties": {
        "reason": { "type": "string", "minLength": 10, "description": "Why it is going away, in English, for the people building prototypes." },
        "replacedBy": { "type": "string", "description": "The id to use instead: a product id on a product, a variant id of the same product on a variant." }
      }
    },
    "localized": {
      "type": "object",
      "additionalProperties": false,
      "required": ["en", "pt-BR"],
      "properties": {
        "en": { "type": "string", "minLength": 1 },
        "pt-BR": { "type": "string", "minLength": 1 }
      }
    },
    "localizedList": {
      "type": "object",
      "additionalProperties": false,
      "required": ["en", "pt-BR"],
      "properties": {
        "en": { "type": "array", "minItems": 1, "items": { "type": "string", "minLength": 1 } },
        "pt-BR": { "type": "array", "minItems": 1, "items": { "type": "string", "minLength": 1 } }
      }
    },
    "money": {
      "type": "object",
      "additionalProperties": false,
      "required": ["BRL", "USD"],
      "properties": {
        "BRL": { "type": "number", "exclusiveMinimum": 0 },
        "USD": { "type": "number", "exclusiveMinimum": 0 }
      }
    },
    "photo": {
      "type": "object",
      "additionalProperties": false,
      "required": ["alt", "backgrounds"],
      "description": "One shot of the product, on both backgrounds.",
      "properties": {
        "alt": { "$ref": "#/$defs/localized" },
        "backgrounds": {
          "type": "object",
          "additionalProperties": false,
          "required": ["#ffffff", "#f5f5f5"],
          "properties": {
            "#ffffff": { "type": "string", "description": "Source PNG on a pure white background, named <slug>-white.png. The slug names the shot. catalog.json serves the WebP generated from it." },
            "#f5f5f5": { "type": "string", "description": "Source PNG of the same photo on #f5f5f5, named <slug>-gray.png. Produced by npm run backgrounds. catalog.json serves the WebP generated from it." }
          }
        }
      }
    }
  },
  "properties": {
    "id": {
      "type": "string",
      "pattern": "^[a-z0-9]+(?:-[a-z0-9]+)*$",
      "description": "kebab-case slug in English. Must match the file name and the images folder."
    },
    "brandId": { "type": "string", "description": "Optional id from brands.json. Omit it when the product has no brand. The name lives on the brand, so it is written once." },
    "specifications": {
      "type": "array",
      "description": "Shared attributes a shopper filters or compares, such as material or capacity. Each valueId comes from specifications.json. Repeat an id to give a product several values of the same spec.",
      "items": {
        "type": "object",
        "additionalProperties": false,
        "required": ["id", "valueId"],
        "properties": {
          "id": { "type": "string", "description": "A specification id from specifications.json." },
          "valueId": { "type": "string", "description": "A value id of that specification." }
        }
      }
    },
    "categoryId": { "type": "string", "description": "An id from categories.json." },
    "unitId": {
      "type": "string",
      "description": "How it is sold: one id from units.json, the thing one price buys and one step of the quantity counts (can, bag, piece, area…). Leave it out for a single item (\"unit\"). A variant sold differently (an 18 L bucket next to a 3.6 L can) sets its own."
    },
    "deprecated": { "$ref": "#/$defs/deprecated" },
    "name": {
      "$ref": "#/$defs/localized",
      "description": "Long, marketplace-style listing name (product, size, material, color, key features; a brand only when the product has one). At least 60 characters per locale."
    },
    "description": {
      "$ref": "#/$defs/localized",
      "description": "Two or three sentences. At least 80 characters per locale."
    },
    "price": { "$ref": "#/$defs/money", "description": "Current selling price in each currency." },
    "listPrice": {
      "$ref": "#/$defs/money",
      "description": "Pre-discount price. Only set it when the product is on sale; each currency must be greater than the matching price."
    },
    "availability": { "type": "string", "enum": ["in_stock", "low_stock", "out_of_stock"] },
    "tags": { "$ref": "#/$defs/localizedList" },
    "defaultVariantId": { "type": "string", "description": "The variant a product card shows before the shopper picks anything." },
    "options": {
      "type": "array",
      "minItems": 1,
      "description": "The axes a shopper chooses: color, size, volume, capacity, pack count, or anything else the product needs. A product can have several.",
      "items": {
        "type": "object",
        "additionalProperties": false,
        "required": ["id", "values"],
        "properties": {
          "id": { "type": "string", "pattern": "^[a-z0-9]+(?:-[a-z0-9]+)*$" },
          "specificationId": { "type": "string", "description": "When set, the option name and each value name come from this specification. Used for shared values such as apparel sizes." },
          "name": { "$ref": "#/$defs/localized", "description": "Required unless specificationId is set." },
          "values": {
            "type": "array",
            "minItems": 1,
            "items": {
              "type": "object",
              "additionalProperties": false,
              "required": ["id"],
              "properties": {
                "id": { "type": "string", "pattern": "^[a-z0-9]+(?:-[a-z0-9]+)*$" },
                "valueId": { "type": "string", "description": "A value of the option's specificationId. The localized name lives there. Omit name when this is set." },
                "name": { "$ref": "#/$defs/localized", "description": "Required unless valueId is set." },
                "hex": { "type": "string", "pattern": "^#[0-9A-Fa-f]{6}$", "description": "Swatch color. Required when the option id is color." }
              }
            }
          }
        }
      }
    },
    "variants": {
      "type": "array",
      "minItems": 1,
      "description": "One entry per combination you sell. Price, stock and photos live here.",
      "items": {
        "type": "object",
        "additionalProperties": false,
        "required": ["id", "sku", "options", "price", "availability", "images"],
        "properties": {
          "id": { "type": "string", "pattern": "^[a-z0-9]+(?:-[a-z0-9]+)*$" },
          "sku": { "type": "string", "minLength": 1 },
          "unitId": { "type": "string", "description": "Only when this variant is sold differently from the product's unitId, such as a bucket among cans or a box among pieces." },
          "options": { "type": "object", "additionalProperties": { "type": "string" }, "description": "option id to value id, e.g. { \"color\": \"sage\", \"size\": \"queen\" }" },
          "price": { "$ref": "#/$defs/money" },
          "listPrice": { "$ref": "#/$defs/money" },
          "availability": { "type": "string", "enum": ["in_stock", "low_stock", "out_of_stock"] },
          "deprecated": { "$ref": "#/$defs/deprecated" },
          "images": {
            "type": "array",
            "minItems": 1,
            "items": { "$ref": "#/$defs/photo" }
          }
        }
      }
    }
  }
}
