{
  "id": "white-wall-outlet-single-module",
  "deprecated": {
    "reason": "Folded into \"white-duplex-outlet\" as a variant (model): it has the same photo and only that choice differs.",
    "replacedBy": "white-duplex-outlet"
  },
  "categoryId": "construcao-eletrica",
  "name": {
    "en": "White Wall Outlet for Residential Branch Circuits, Single Module for Compact Wall Boxes, Sold in Two Project Packs",
    "pt-BR": "Tomada Branca de Parede para Circuito Residencial, Módulo Simples para Caixa de Parede Compacta, Vendido em Duas Opções de Embalagem"
  },
  "description": {
    "en": "A generic electrical component for dry indoor residential circuits. Match the stated gauge, current or module configuration to the project and have the installation checked locally. This listing is for white wall outlet for residential branch circuits, single module for compact wall boxes.",
    "pt-BR": "Um componente elétrico genérico para circuitos residenciais internos e secos. Confira bitola, corrente ou configuração do módulo no projeto e valide a instalação no local. Este anúncio apresenta tomada branca de parede para circuito residencial, módulo simples para caixa de parede compacta."
  },
  "price": {
    "BRL": 13.11,
    "USD": 5.72
  },
  "availability": "in_stock",
  "tags": {
    "en": [
      "white wall outlet for residential branch circuits",
      "single module for compact wall boxes",
      "construction"
    ],
    "pt-BR": [
      "tomada branca de parede para circuito residencial",
      "módulo simples para caixa de parede compacta",
      "construção"
    ]
  },
  "specifications": [
    {
      "id": "material",
      "valueId": "polycarbonate"
    },
    {
      "id": "application",
      "valueId": "indoor"
    }
  ],
  "defaultVariantId": "single",
  "options": [
    {
      "id": "color",
      "name": {
        "en": "Color",
        "pt-BR": "Cor"
      },
      "values": [
        {
          "id": "white",
          "name": {
            "en": "White",
            "pt-BR": "Branco"
          },
          "hex": "#F7F7F5"
        }
      ]
    },
    {
      "id": "pack",
      "name": {
        "en": "Pack",
        "pt-BR": "Pacote"
      },
      "values": [
        {
          "id": "single",
          "name": {
            "en": "1 piece",
            "pt-BR": "1 peça"
          }
        },
        {
          "id": "ten",
          "name": {
            "en": "10 pieces",
            "pt-BR": "10 peças"
          }
        }
      ]
    }
  ],
  "variants": [
    {
      "id": "single",
      "sku": "CON-WHITE-WALL-OUTLET-SINGLE-MODULE-SINGLE",
      "options": {
        "color": "white",
        "pack": "single"
      },
      "price": {
        "BRL": 13.11,
        "USD": 5.72
      },
      "availability": "in_stock",
      "images": [
        {
          "alt": {
            "en": "White Wall Outlet for Residential Branch Circuits, Single Module for Compact Wall Boxes, isolated product view",
            "pt-BR": "Tomada Branca de Parede para Circuito Residencial, Módulo Simples para Caixa de Parede Compacta, vista isolada do produto"
          },
          "backgrounds": {
            "#ffffff": "main-white.png",
            "#f5f5f5": "main-gray.png"
          }
        },
        {
          "alt": {
            "en": "Close detail of White Wall Outlet for Residential Branch Circuits, Single Module for Compact Wall Boxes, Sold in Two Project Packs",
            "pt-BR": "Detalhe aproximado de Tomada Branca de Parede para Circuito Residencial, Módulo Simples para Caixa de Parede Compacta, Vendido em Duas Opções de Embalagem"
          },
          "backgrounds": {
            "#ffffff": "detail-white.png",
            "#f5f5f5": "detail-gray.png"
          }
        }
      ]
    },
    {
      "id": "ten",
      "sku": "CON-WHITE-WALL-OUTLET-SINGLE-MODULE-TEN",
      "options": {
        "color": "white",
        "pack": "ten"
      },
      "price": {
        "BRL": 113.1,
        "USD": 45.62
      },
      "availability": "low_stock",
      "images": [
        {
          "alt": {
            "en": "White Wall Outlet for Residential Branch Circuits, Single Module for Compact Wall Boxes, isolated product view",
            "pt-BR": "Tomada Branca de Parede para Circuito Residencial, Módulo Simples para Caixa de Parede Compacta, vista isolada do produto"
          },
          "backgrounds": {
            "#ffffff": "main-white.png",
            "#f5f5f5": "main-gray.png"
          }
        },
        {
          "alt": {
            "en": "Close detail of White Wall Outlet for Residential Branch Circuits, Single Module for Compact Wall Boxes, Sold in Two Project Packs",
            "pt-BR": "Detalhe aproximado de Tomada Branca de Parede para Circuito Residencial, Módulo Simples para Caixa de Parede Compacta, Vendido em Duas Opções de Embalagem"
          },
          "backgrounds": {
            "#ffffff": "detail-white.png",
            "#f5f5f5": "detail-gray.png"
          }
        }
      ]
    }
  ]
}
