{
  "id": "casa-norte-t12-c-compact-drill-driver",
  "brandId": "casa-norte",
  "categoryId": "construcao-ferramentas-eletricas",
  "name": {
    "en": "Casa Norte T12-C Compact 12-Volt Cordless Drill Driver with 3/8-Inch Keyless Chuck",
    "pt-BR": "Furadeira e Parafusadeira Casa Norte T12-C Compacta 12 V com Mandril sem Chave de 10 mm"
  },
  "description": {
    "en": "A short, light drill driver for furniture assembly, pilot holes, and everyday fastening in wood or metal. Its compact body reaches between cabinet panels, and the 3/8-inch chuck accepts common household bits.",
    "pt-BR": "Furadeira e parafusadeira curta e leve para montar móveis, abrir furos-guia e fazer fixações em madeira ou metal. O corpo compacto entra entre painéis de armário, e o mandril de 10 mm aceita brocas comuns."
  },
  "price": {
    "BRL": 329.9,
    "USD": 89
  },
  "availability": "in_stock",
  "tags": {
    "en": [
      "Casa Norte T12-C",
      "compact cordless drill",
      "cabinet assembly"
    ],
    "pt-BR": [
      "Casa Norte T12-C",
      "furadeira compacta a bateria",
      "montagem de móveis"
    ]
  },
  "specifications": [
    {
      "id": "tool-type",
      "valueId": "drill-driver"
    },
    {
      "id": "power-source",
      "valueId": "battery"
    },
    {
      "id": "voltage",
      "valueId": "12-v"
    }
  ],
  "defaultVariantId": "tool-only",
  "options": [
    {
      "id": "color",
      "name": {
        "en": "Color",
        "pt-BR": "Cor"
      },
      "values": [
        {
          "id": "cobalt-blue",
          "name": {
            "en": "Cobalt blue",
            "pt-BR": "Azul cobalto"
          },
          "hex": "#245FD1"
        }
      ]
    },
    {
      "id": "package",
      "name": {
        "en": "Package",
        "pt-BR": "Conjunto"
      },
      "values": [
        {
          "id": "tool-only",
          "name": {
            "en": "Tool only",
            "pt-BR": "Somente ferramenta"
          }
        },
        {
          "id": "battery-kit",
          "name": {
            "en": "Battery and charger kit",
            "pt-BR": "Kit com bateria e carregador"
          }
        }
      ]
    }
  ],
  "variants": [
    {
      "id": "tool-only",
      "sku": "CON-T12C-TOOL-ONLY",
      "options": {
        "color": "cobalt-blue",
        "package": "tool-only"
      },
      "price": {
        "BRL": 329.9,
        "USD": 89
      },
      "availability": "in_stock",
      "images": [
        {
          "alt": {
            "en": "Casa Norte T12-C Compact 12-Volt Cordless Drill Driver with 3/8-Inch Keyless Chuck, isolated product view",
            "pt-BR": "Furadeira e Parafusadeira Casa Norte T12-C Compacta 12 V com Mandril sem Chave de 10 mm, vista isolada do produto"
          },
          "backgrounds": {
            "#ffffff": "main-white.png",
            "#f5f5f5": "main-gray.png"
          }
        },
        {
          "alt": {
            "en": "Casa Norte T12-C driving a screw while assembling a cabinet",
            "pt-BR": "Casa Norte T12-C parafusando durante a montagem de um armário"
          },
          "backgrounds": {
            "#ffffff": "application-white.png",
            "#f5f5f5": "application-gray.png"
          }
        }
      ]
    },
    {
      "id": "battery-kit",
      "sku": "CON-T12C-BATTERY-KIT",
      "options": {
        "color": "cobalt-blue",
        "package": "battery-kit"
      },
      "price": {
        "BRL": 499.9,
        "USD": 139
      },
      "availability": "low_stock",
      "images": [
        {
          "alt": {
            "en": "Casa Norte T12-C Compact 12-Volt Cordless Drill Driver with 3/8-Inch Keyless Chuck, isolated product view",
            "pt-BR": "Furadeira e Parafusadeira Casa Norte T12-C Compacta 12 V com Mandril sem Chave de 10 mm, vista isolada do produto"
          },
          "backgrounds": {
            "#ffffff": "main-white.png",
            "#f5f5f5": "main-gray.png"
          }
        },
        {
          "alt": {
            "en": "Casa Norte T12-C driving a screw while assembling a cabinet",
            "pt-BR": "Casa Norte T12-C parafusando durante a montagem de um armário"
          },
          "backgrounds": {
            "#ffffff": "application-white.png",
            "#f5f5f5": "application-gray.png"
          }
        }
      ]
    }
  ]
}
