{
  "id": "copper-building-wire-fifteen-meter",
  "categoryId": "construcao-eletrica",
  "name": {
    "en": "Copper Building Wire for Indoor Branch Circuits, 15 Meter Roll for Small Renovations, Sold in Two Project Packs",
    "pt-BR": "Fio de Cobre para Circuito Elétrico Interno, Rolo de 15 Metros para Pequenas Reformas, Vendido em Duas Opções de Embalagem"
  },
  "description": {
    "en": "A generic electrical component for dry indoor residential circuits. Match the stated gauge, current or module configuration to the project and have the installation checked locally. This listing is for copper building wire for indoor branch circuits, 15 meter roll for small renovations.",
    "pt-BR": "Um componente elétrico genérico para circuitos residenciais internos e secos. Confira bitola, corrente ou configuração do módulo no projeto e valide a instalação no local. Este anúncio apresenta fio de cobre para circuito elétrico interno, rolo de 15 metros para pequenas reformas."
  },
  "price": {
    "BRL": 58.88,
    "USD": 25.96
  },
  "availability": "in_stock",
  "tags": {
    "en": [
      "copper building wire for indoor branch circuits",
      "15 meter roll for small renovations",
      "construction"
    ],
    "pt-BR": [
      "fio de cobre para circuito elétrico interno",
      "rolo de 15 metros para pequenas reformas",
      "construção"
    ]
  },
  "specifications": [
    {
      "id": "material",
      "valueId": "copper"
    },
    {
      "id": "application",
      "valueId": "indoor"
    }
  ],
  "defaultVariantId": "short",
  "options": [
    {
      "id": "color",
      "name": {
        "en": "Color",
        "pt-BR": "Cor"
      },
      "values": [
        {
          "id": "copper",
          "name": {
            "en": "Copper",
            "pt-BR": "Cobre"
          },
          "hex": "#B87333"
        }
      ]
    },
    {
      "id": "length",
      "name": {
        "en": "Length",
        "pt-BR": "Comprimento"
      },
      "values": [
        {
          "id": "short",
          "name": {
            "en": "50 ft",
            "pt-BR": "15 m"
          }
        },
        {
          "id": "long",
          "name": {
            "en": "100 ft",
            "pt-BR": "30 m"
          }
        }
      ]
    }
  ],
  "variants": [
    {
      "id": "short",
      "sku": "CON-COPPER-BUILDING-WIRE-FIFTEEN-METER-SHORT",
      "options": {
        "color": "copper",
        "length": "short"
      },
      "price": {
        "BRL": 58.88,
        "USD": 25.96
      },
      "availability": "in_stock",
      "images": [
        {
          "alt": {
            "en": "Copper Building Wire for Indoor Branch Circuits, 15 Meter Roll for Small Renovations, isolated product view",
            "pt-BR": "Fio de Cobre para Circuito Elétrico Interno, Rolo de 15 Metros para Pequenas Reformas, vista isolada do produto"
          },
          "backgrounds": {
            "#ffffff": "main-white.png",
            "#f5f5f5": "main-gray.png"
          }
        }
      ]
    },
    {
      "id": "long",
      "sku": "CON-COPPER-BUILDING-WIRE-FIFTEEN-METER-LONG",
      "options": {
        "color": "copper",
        "length": "long"
      },
      "price": {
        "BRL": 240.86,
        "USD": 99.4
      },
      "availability": "low_stock",
      "images": [
        {
          "alt": {
            "en": "Copper Building Wire for Indoor Branch Circuits, 15 Meter Roll for Small Renovations, isolated product view",
            "pt-BR": "Fio de Cobre para Circuito Elétrico Interno, Rolo de 15 Metros para Pequenas Reformas, vista isolada do produto"
          },
          "backgrounds": {
            "#ffffff": "main-white.png",
            "#f5f5f5": "main-gray.png"
          }
        }
      ]
    }
  ]
}
