{
  "id": "ivory-wrap-viscose-midi",
  "brandId": "fio-puro",
  "categoryId": "roupa-vestidos",
  "name": {
    "en": "Fio Puro Ivory Wrap Midi Dress in Viscose with a Surplice Opening, Self Tie and a Fluid Skirt",
    "pt-BR": "Vestido midi transpassado Fio Puro marfim de viscose, com decote cruzado, amarração e saia que acompanha o passo"
  },
  "description": {
    "en": "A viscose wrap midi that ties at the waist and moves when you walk. The surplice neck stays modest without feeling stiff.",
    "pt-BR": "Midi transpassado de viscose, amarrado na cintura, que acompanha o passo. O decote cruzado cobre sem endurecer."
  },
  "price": {
    "BRL": 890,
    "USD": 186
  },
  "availability": "in_stock",
  "tags": {
    "en": [
      "ivory wrap midi dress"
    ],
    "pt-BR": [
      "vestido midi transpassado fio"
    ]
  },
  "specifications": [
    {
      "id": "material",
      "valueId": "viscose"
    }
  ],
  "defaultVariantId": "ivory-s",
  "options": [
    {
      "id": "color",
      "name": {
        "en": "Color",
        "pt-BR": "Cor"
      },
      "values": [
        {
          "id": "ivory",
          "name": {
            "en": "Ivory",
            "pt-BR": "Marfim"
          },
          "hex": "#F3EDE4"
        }
      ]
    },
    {
      "id": "size",
      "specificationId": "size",
      "values": [
        {
          "id": "s",
          "valueId": "s"
        },
        {
          "id": "m",
          "valueId": "m"
        },
        {
          "id": "l",
          "valueId": "l"
        }
      ]
    }
  ],
  "variants": [
    {
      "id": "ivory-s",
      "sku": "FIO-IWV-S",
      "options": {
        "color": "ivory",
        "size": "s"
      },
      "price": {
        "BRL": 890,
        "USD": 186
      },
      "availability": "in_stock",
      "images": [
        {
          "alt": {
            "en": "Ivory Wrap Midi Dress in Viscose with a Surplice Opening, Self Tie and a Fluid Skirt, front view",
            "pt-BR": "Vestido midi transpassado Fio Puro marfim de viscose, com decote cruzado, amarração e saia que acompanha o passo, Marfim, vista frontal"
          },
          "backgrounds": {
            "#ffffff": "ivory-white.png",
            "#f5f5f5": "ivory-gray.png"
          }
        },
        {
          "alt": {
            "en": "Close detail of Fio Puro Ivory Wrap Midi Dress in Viscose with a Surplice Opening, Self Tie and a Fluid Skirt",
            "pt-BR": "Detalhe aproximado de Vestido midi transpassado Fio Puro marfim de viscose, com decote cruzado, amarração e saia que acompanha o passo"
          },
          "backgrounds": {
            "#ffffff": "detail-white.png",
            "#f5f5f5": "detail-gray.png"
          }
        }
      ]
    },
    {
      "id": "ivory-m",
      "sku": "FIO-IWV-M",
      "options": {
        "color": "ivory",
        "size": "m"
      },
      "price": {
        "BRL": 890,
        "USD": 186
      },
      "availability": "in_stock",
      "images": [
        {
          "alt": {
            "en": "Ivory Wrap Midi Dress in Viscose with a Surplice Opening, Self Tie and a Fluid Skirt, front view",
            "pt-BR": "Vestido midi transpassado Fio Puro marfim de viscose, com decote cruzado, amarração e saia que acompanha o passo, Marfim, vista frontal"
          },
          "backgrounds": {
            "#ffffff": "ivory-white.png",
            "#f5f5f5": "ivory-gray.png"
          }
        },
        {
          "alt": {
            "en": "Close detail of Fio Puro Ivory Wrap Midi Dress in Viscose with a Surplice Opening, Self Tie and a Fluid Skirt",
            "pt-BR": "Detalhe aproximado de Vestido midi transpassado Fio Puro marfim de viscose, com decote cruzado, amarração e saia que acompanha o passo"
          },
          "backgrounds": {
            "#ffffff": "detail-white.png",
            "#f5f5f5": "detail-gray.png"
          }
        }
      ]
    },
    {
      "id": "ivory-l",
      "sku": "FIO-IWV-L",
      "options": {
        "color": "ivory",
        "size": "l"
      },
      "price": {
        "BRL": 890,
        "USD": 186
      },
      "availability": "low_stock",
      "images": [
        {
          "alt": {
            "en": "Ivory Wrap Midi Dress in Viscose with a Surplice Opening, Self Tie and a Fluid Skirt, front view",
            "pt-BR": "Vestido midi transpassado Fio Puro marfim de viscose, com decote cruzado, amarração e saia que acompanha o passo, Marfim, vista frontal"
          },
          "backgrounds": {
            "#ffffff": "ivory-white.png",
            "#f5f5f5": "ivory-gray.png"
          }
        },
        {
          "alt": {
            "en": "Close detail of Fio Puro Ivory Wrap Midi Dress in Viscose with a Surplice Opening, Self Tie and a Fluid Skirt",
            "pt-BR": "Detalhe aproximado de Vestido midi transpassado Fio Puro marfim de viscose, com decote cruzado, amarração e saia que acompanha o passo"
          },
          "backgrounds": {
            "#ffffff": "detail-white.png",
            "#f5f5f5": "detail-gray.png"
          }
        }
      ]
    }
  ]
}
