{
  "id": "self-leveling-compound-renovation",
  "categoryId": "construcao-argamassas",
  "name": {
    "en": "Gray Self-Leveling Compound for Concrete Floors, for Renovation over Prepared Substrates, Sold in Two Project Packs",
    "pt-BR": "Massa Autonivelante Cinza para Piso de Concreto, para Reforma sobre Base Preparada, Vendido em Duas Opções de Embalagem"
  },
  "description": {
    "en": "A cement-based preparation for a specific stage of a residential build. The application label separates tile setting, leveling and wall preparation for more accurate material lists. This listing is for gray self-leveling compound for concrete floors, for renovation over prepared substrates.",
    "pt-BR": "Uma preparação cimentícia para uma etapa específica da obra residencial. A indicação de uso separa assentamento, nivelamento e preparo de parede para listas mais precisas. Este anúncio apresenta massa autonivelante cinza para piso de concreto, para reforma sobre base preparada."
  },
  "price": {
    "BRL": 75.11,
    "USD": 30.08
  },
  "availability": "in_stock",
  "tags": {
    "en": [
      "gray self-leveling compound for concrete floors",
      "for renovation over prepared substrates",
      "construction"
    ],
    "pt-BR": [
      "massa autonivelante cinza para piso de concreto",
      "para reforma sobre base preparada",
      "construção"
    ]
  },
  "specifications": [
    {
      "id": "material",
      "valueId": "cement"
    },
    {
      "id": "application",
      "valueId": "indoor"
    },
    {
      "id": "tone",
      "valueId": "medium"
    }
  ],
  "defaultVariantId": "one",
  "options": [
    {
      "id": "color",
      "name": {
        "en": "Color",
        "pt-BR": "Cor"
      },
      "values": [
        {
          "id": "gray",
          "name": {
            "en": "Gray",
            "pt-BR": "Cinza"
          },
          "hex": "#B7B7B2"
        }
      ]
    },
    {
      "id": "pack",
      "name": {
        "en": "Pack",
        "pt-BR": "Pacote"
      },
      "values": [
        {
          "id": "one",
          "name": {
            "en": "1 bucket",
            "pt-BR": "1 balde"
          }
        },
        {
          "id": "five",
          "name": {
            "en": "5 buckets",
            "pt-BR": "5 baldes"
          }
        }
      ]
    }
  ],
  "variants": [
    {
      "id": "one",
      "sku": "CON-SELF-LEVELING-COMPOUND-RENOVATION-ONE",
      "options": {
        "color": "gray",
        "pack": "one"
      },
      "price": {
        "BRL": 75.11,
        "USD": 30.08
      },
      "availability": "in_stock",
      "images": [
        {
          "alt": {
            "en": "Gray Self-Leveling Compound for Concrete Floors, for Renovation over Prepared Substrates, isolated product view",
            "pt-BR": "Massa Autonivelante Cinza para Piso de Concreto, para Reforma sobre Base Preparada, vista isolada do produto"
          },
          "backgrounds": {
            "#ffffff": "main-white.png",
            "#f5f5f5": "main-gray.png"
          }
        },
        {
          "alt": {
            "en": "Close detail of Gray Self-Leveling Compound for Concrete Floors, for Renovation over Prepared Substrates, Sold in Two Project Packs",
            "pt-BR": "Detalhe aproximado de Massa Autonivelante Cinza para Piso de Concreto, para Reforma sobre Base Preparada, Vendido em Duas Opções de Embalagem"
          },
          "backgrounds": {
            "#ffffff": "detail-white.png",
            "#f5f5f5": "detail-gray.png"
          }
        }
      ]
    },
    {
      "id": "five",
      "sku": "CON-SELF-LEVELING-COMPOUND-RENOVATION-FIVE",
      "options": {
        "color": "gray",
        "pack": "five"
      },
      "price": {
        "BRL": 374.61,
        "USD": 150.25
      },
      "availability": "low_stock",
      "images": [
        {
          "alt": {
            "en": "Gray Self-Leveling Compound for Concrete Floors, for Renovation over Prepared Substrates, isolated product view",
            "pt-BR": "Massa Autonivelante Cinza para Piso de Concreto, para Reforma sobre Base Preparada, vista isolada do produto"
          },
          "backgrounds": {
            "#ffffff": "main-white.png",
            "#f5f5f5": "main-gray.png"
          }
        },
        {
          "alt": {
            "en": "Close detail of Gray Self-Leveling Compound for Concrete Floors, for Renovation over Prepared Substrates, Sold in Two Project Packs",
            "pt-BR": "Detalhe aproximado de Massa Autonivelante Cinza para Piso de Concreto, para Reforma sobre Base Preparada, Vendido em Duas Opções de Embalagem"
          },
          "backgrounds": {
            "#ffffff": "detail-white.png",
            "#f5f5f5": "detail-gray.png"
          }
        }
      ]
    }
  ]
}
